<?xml version="1.0" ?>
<dailyTransaction date="24/02/2015" 
xmlns:xsi="http://www.w3.org/2001/XMLSchema-instance" xsi:schemaLocation="dailyTransaction.xsd"> 
  <person staffDbId="103" operation="update">
    <firstName>John</firstName>
    <lastName>Smith</lastName>
    <mobile>0211223344</mobile>
  </person>
  <person staffDbId="-1" operation="add">
    <firstName>Mary</firstName>
    <lastName>Jane</lastName>
    <mobile>0244556677</mobile>
  </person>
</dailyTransaction>

